pergunta,resposta
"O que é depressão?","Depressão é um distúrbio de humor que causa uma sensação persistente de tristeza."
"Quais são os sintomas da depressão?","Os sintomas incluem tristeza persistente, falta de interesse em atividades, alterações no sono e apetite."
"Como lidar com a ansiedade?","Existem várias maneiras de lidar com a ansiedade, como terapia cognitivo-comportamental e meditação."
"O que é transtorno de ansiedade?","Transtorno de ansiedade é um grupo de distúrbios que causam preocupação excessiva e medo."
"Como a terapia pode ajudar?","A terapia pode ajudar a identificar padrões de pensamento negativos e desenvolver estratégias de enfrentamento."
"Quais são os efeitos do estresse?","O estresse pode causar problemas físicos e mentais, como insônia, dor de cabeça e ansiedade."
"Como posso melhorar meu sono?","Praticar uma rotina relaxante antes de dormir e evitar eletrônicos pode ajudar a melhorar o sono."
"O que é a meditação?","Meditação é uma prática que envolve focar a mente e pode ajudar a reduzir a ansiedade e o estresse."
"Quando devo procurar ajuda profissional?","Se os sintomas estiverem interferindo na vida diária, é importante buscar ajuda de um profissional de saúde mental."
"Quais são os tipos de terapia disponíveis?","Existem várias formas de terapia, como terapia cognitivo-comportamental, terapia de grupo e terapia psicodinâmica."
"Como o exercício físico pode ajudar na saúde mental?","O exercício regular pode melhorar o humor, reduzir a ansiedade e aumentar a autoestima."
"O que são distúrbios alimentares?","Distúrbios alimentares são condições graves relacionadas a comportamentos alimentares extremos e podem afetar a saúde mental."
"Como lidar com crises de pânico?","Técnicas de respiração, mindfulness e terapia podem ajudar a lidar com crises de pânico."
"O que é mindfulness?","Mindfulness é a prática de estar presente no momento e pode ajudar a reduzir o estresse e a ansiedade."
"Quais são os benefícios da terapia em grupo?","A terapia em grupo oferece apoio social, permite a troca de experiências e pode ser menos custosa."
"O que é a saúde mental?","A saúde mental refere-se ao bem-estar emocional, psicológico e social, afetando como pensamos, sentimos e agimos."
"Como a alimentação pode influenciar a saúde mental?","Uma alimentação equilibrada pode melhorar o humor e a função cognitiva, enquanto dietas ruins podem contribuir para problemas mentais."
"Quais são os sinais de alerta de problemas de saúde mental?","Mudanças de humor, isolamento social e alterações no apetite ou sono são sinais de alerta."
"Como o sono afeta a saúde mental?","A falta de sono pode agravar a ansiedade, depressão e outros distúrbios mentais."
"Quais são os efeitos do álcool na saúde mental?","O álcool pode inicialmente parecer relaxante, mas pode piorar a ansiedade e a depressão a longo prazo."
"Como a prática de hobbies pode ajudar na saúde mental?","Atividades prazerosas ajudam a reduzir o estresse, aumentar a satisfação e promover o bem-estar emocional."
"Quais são as consequências da solidão?","A solidão pode levar a sentimentos de tristeza, ansiedade e pode ter efeitos negativos na saúde física e mental."
"Como o suporte social pode ajudar?","Ter uma rede de apoio pode ajudar a enfrentar dificuldades, reduzindo a sensação de solidão e promovendo o bem-estar."
"Quais são os métodos de autoconhecimento?","Diários, meditação e reflexão pessoal são métodos eficazes para o autoconhecimento."
"Como lidar com críticas e rejeições?","Aprender a ver as críticas como oportunidades de crescimento pode ajudar a desenvolver a resiliência."
"Qual é o papel da espiritualidade na saúde mental?","A espiritualidade pode proporcionar conforto, propósito e conexão, contribuindo para a saúde mental."
"Como a terapia de arte pode ajudar?","A terapia de arte permite expressar emoções de forma criativa, o que pode ser terapêutico."
"Qual é a importância do autocuidado?","O autocuidado é essencial para manter o equilíbrio emocional e prevenir o esgotamento."
"Como a música pode afetar o humor?","A música pode influenciar as emoções e pode ser usada como uma ferramenta para melhorar o bem-estar."
"O que é a síndrome do impostor?","A síndrome do impostor é um padrão de pensamento onde uma pessoa duvida de suas conquistas e teme ser exposta como uma fraude."
"Como as redes sociais afetam a saúde mental?","O uso excessivo de redes sociais pode contribuir para a comparação social e sentimentos de inadequação."
"O que é a terapia comportamental dialética (DBT)?","A DBT é uma forma de terapia que ajuda as pessoas a lidar com emoções intensas e melhorar relacionamentos."
"Quais são os benefícios da terapia online?","A terapia online oferece flexibilidade, acessibilidade e pode ser uma opção conveniente para muitos."
"Como posso ajudar alguém com problemas de saúde mental?","Ofereça apoio, ouça sem julgamento e incentive a busca de ajuda profissional."
